<?xml version="1.0" encoding="UTF-8"?>
<!DOCTYPE help SYSTEM "../../../include/dtd/help.dtd">
<help title="Administrator Verwaltung" xams-release="0.0.9" file-release="0.0.9" file-revision="1" date="2002-11-31">
    <lngspec name="german" iso="de" localname="deutsch"/>
    <skindir>{{skindir}}</skindir>
    <maintainers>
        <maintainer>
            <name>XAMS Core-Team</name>
            <email>info@xams.org</email>
        </maintainer>
    </maintainers>
    <information>
        Ein Administrator kann ohne jegliche Einschränkungen in
        sämtlichen Daten Änderungen vornehmen. Er besitzt
        vollständigen Zugriff auf alle Funktionen von XAMS und kann
        somit problemlos alle Wiederverkäufer und ggf. auch deren
        Endkunden verwalten.
    </information>
    <section>
        <head>Administrator Name</head>
        <description>
            Dies ist der Name des Administrators, so wie er bspw. auch
            im Ereignis-Log erscheint. Beim Login muss diesem Namen
            ein "adm_" vorangestellt werden, damit XAMS weiß um welche
            Art Benutzer es sich handelt.
        </description>
    </section>
    <section>
        <head>Administrator Passwort</head>
        <description>
            In Verbindung mit dem Namen und diesem Passwort, kann sich ein
            Administrator an der XAMS GUI anmelden.
        </description>
    </section>
    <section>
        <head>Konto gesperrt</head>
        <condition>not_himself</condition>
        <description>
            Mit dieser Option kann ein Administrator andere Administratoren
            sperren. Dadurch können sich diese nicht mehr an der XAMS
            GUI anmelden.
        </description>
    </section>
</help>