<?xml version="1.0" encoding="UTF-8"?>
<!DOCTYPE help SYSTEM "../../../include/dtd/help.dtd">
<help title="Comptes XAMS" xams-release="0.0.19" file-release="0.0.9" file-revision="1" date="2008-12-03">
    <lngspec name="french" iso="fr" localname="french"/>
    <skindir>{{skindir}}</skindir>
    <maintainers>
        <maintainer>
            <name>ACTION-WEB</name>
            <email>xams@actionweb.fr</email>
        </maintainer>
    </maintainers>
        <information>
        XAMS atteint un maximum de flexibilité et de fonctionnalité dans l'administration
        d'un système de messagerie en raison de son architecture à 3 niveaux, à savoir :
        "administrateurs", "revendeurs" et "clients".
    </information>
    <section>
        <head>Administrateurs</head>
        <description>
            Un administrateur peut effectuer des changements sur toutes les données sans
            aucune limitation. Il a accès total à l'ensemble de toutes les fonctions de XAMS
            et peut administer ainsi tous les revendeurs et si nécessaire intervenir même
            sur les données des clients.
        </description>
    </section>
    <section>
        <head>Revendeurs</head>
        <description>
            L'administrateur assigne tous les sites clients désirés à un revendeur. Ces sites
            peuvent alors être administré par ce revendeur qui doit s'en tenir aux limitations
            données par l'administrateur.
            
            Il peut effectuer des changements - selon les limites définies - sur tous ses clients
            et également les contrôler. Contrairement à l'administrateur, il ne peut pas effectuer
            des changements sur les préférences du système, sur les configurations du Carnet d'Addresse,
            et il ne lui est pas possible d'analyser la base de données. En plus de cela, il ne peut
            naturellement pas accéder aux clients appartenant à un autre revendeur.
        </description>
    </section>
    <section>
        <head>Clients</head>
        <description>
            Un revendeur (sous la responsabilité d'un administrateur) assigne des sites à un
            client. Ces sites peuvent ensuite être administré par le client. Il peut effectuer
            des changements - selon les limites définies par le revendeur et l'administrateur -
            sur tous ses utilisateurs ou ses alias, et également les contrôler.
            Le client ne peut naturellement pas accéder aux utilisateurs ou alias d'un autre client.
        </description>
    </section>
</help>