<?xml version="1.0" encoding="UTF-8"?>
<!DOCTYPE help SYSTEM "../../../include/dtd/help.dtd">
<help title="Assignation des revendeurs" xams-release="0.0.19" file-release="0.0.9" file-revision="1" date="2008-12-03">
    <lngspec name="french" iso="fr" localname="french"/>
    <skindir>{{skindir}}</skindir>
    <maintainers>
        <maintainer>
            <name>ACTION-WEB</name>
            <email>xams@actionweb.fr</email>
        </maintainer>
    </maintainers>
    <information>
        Chaque client peut être assigné à un revendeur spécifique. Grace à cela,
        XAMS est capable d'attribuer les quotas revendeurs aux clients qui lui dépendent.
        Le quota revendeur peut être réduit par la somme de tous les quotas des clients
        et des sites.
    </information>
    <section>
        <head>Revendeur</head>
        <description>
            Sélectionnez ici le revendeur dont dépendra ce client.
        </description>
    </section>
</help>