<?xml version="1.0" encoding="UTF-8"?>
<!DOCTYPE help SYSTEM "../../../include/dtd/help.dtd">
<help title="Wiederverkäufer-Zuordnung" xams-release="0.0.9" file-release="0.0.9" file-revision="1" date="2002-11-31">
    <lngspec name="german" iso="de" localname="deutsch"/>
    <skindir>{{skindir}}</skindir>
    <maintainers>
        <maintainer>
            <name>XAMS Core-Team</name>
            <email>info@xams.org</email>
        </maintainer>
    </maintainers>
    <information>
        Jeder Endkunde muss einem bestimmten Wiederverkäufer zugeordnet werden,
        damit XAMS die Kontingente des Wiederverkäufer auf diesen Endkunden
        abbilden kann, bzw. die Kontingente des Wiederverkäufer, um den
        Verbrauch des Endkunden bzw. dessen Sites, dezimiert werden.
    </information>
    <section>
        <head>Wiederverkäufer</head>
        <description>
            Hier muss der Wiederverkäufer ausgewählt werden, zu dem der
            Endkunde gehören soll.
        </description>
    </section>
</help>