<?xml version="1.0" encoding="UTF-8"?>
<!DOCTYPE help SYSTEM "../../../include/dtd/help.dtd">
<help title="Vue générale des gabarits" xams-release="0.0.19" file-release="0.0.9" file-revision="1" date="2008-12-30">
    <lngspec name="french" iso="fr" localname="french"/>
    <skindir>{{skindir}}</skindir>
    <maintainers>
        <maintainer>
            <name>ACTION-WEB</name>
            <email>xams@actionweb.fr</email>
        </maintainer>
    </maintainers>    
    <information>
        Un gabarit est un système très puissant qui permet de définir des praramètres par
        défaut lors de la création de site ou d'utilisateur. Ceci est très utile pour automatiser
        la création de site ou d'utilisateur qui ont souvent la même structuration. Les gabarits créé par d'autres
        utilisateurs ne sont pas visible.
    </information>
    <section>
        <head>Gabarit de site</head>
        <description>
            Vous permet de créer les gabarits pour les sites. Il est aussi possible de les modifier
            et de les effacer.
        </description>
    </section>
    <section>
        <head>Gabarit d'utilisateur</head>
        <description>
            Vous permet de créer les gabarits pour les utilisateurs. Il est aussi possible de les modifier
            et de les effacer.
        </description>
    </section>
</help>
